title,date_str,siteName,sentiment,pageUrl,author
"‘The US and Norway Blew Up Nord Stream,’ Controversial Journalist Says",d2023-02-14T11:16,KyivPost,-0.207,https://www.kyivpost.com/post/12139,Kyiv Post
'It's Like Verdun': The Grinding Battle for Ukraine's Bakhmut,d2023-02-13T10:22,KyivPost,-0.375,https://www.kyivpost.com/post/12089,AFP
Scholz's Social Democrats Suffer Blow with Berlin Election Loss,d2023-02-13T10:15,KyivPost,-0.711,https://www.kyivpost.com/post/12088,AFP
Berlin Film Festival to Highlight Ukraine and Iran Predicaments,d2023-02-13T10:09,KyivPost,0.411,https://www.kyivpost.com/post/12087,AFP
Planning for Christmas 2023,d2023-02-12T11:54,KyivPost,0.0,https://www.kyivpost.com/post/12015,Andrey Kurkov
Zelensky Says Russian Athletes at Olympics a 'Manifestation of Violence',d2023-02-11T12:12,KyivPost,-0.519,https://www.kyivpost.com/post/12058,AFP
Biden Says Undecided on Poland Visit to Mark Ukraine Anniversary,d2023-02-10T10:27,KyivPost,-0.566,https://www.kyivpost.com/post/12002,AFP
EXPLAINED: The Diplomatic Jealousies Sparked by Zelensky’s European Tour,d2023-02-10T10:13,KyivPost,-0.18,https://www.kyivpost.com/post/12006,Kyiv Post
"Fighter Planes for Ukraine, a Complex Challenge for Kyiv's Allies",d2023-02-09T22:38,KyivPost,0.0,https://www.kyivpost.com/post/12003,AFP
Pink Floyd’s Roger Waters Slammed for UN Speech on Ukraine,d2023-02-09T17:09,KyivPost,-0.33,https://www.kyivpost.com/post/11999,AFP
SpaceX Сurbs Ukraine’s Use of Starlink for Drones,d2023-02-09T15:04,KyivPost,-0.256,https://www.kyivpost.com/post/11995,Kyiv Post
Here’s What Happened at the Last EU-Ukraine Summit,d2023-02-09T10:32,KyivPost,0.0,https://www.kyivpost.com/post/11973,Mark Temnycky
EXPLAINED: What to Expect From Zelensky’s Trip to Brussels Today,d2023-02-09T09:45,KyivPost,0.164,https://www.kyivpost.com/post/11966,Kyiv Post
Ukraine a Sidebar at Best in Biden’s State of the Union Speech,d2023-02-08T15:23,KyivPost,0.0,https://www.kyivpost.com/post/11957,Stefan Korshak
President Zelensky Appeals for Fighter Jets in Address to UK Parliament,d2023-02-08T10:50,KyivPost,0.348,https://www.kyivpost.com/post/11935,Kyiv Post
"Kyiv Post Morning Memo – Everything You Need to Know on Wednesday, Feb. 8",d2023-02-08T10:11,KyivPost,0.0,https://www.kyivpost.com/post/11929,Kyiv Post
"Earthquake Kills More Than 5,000 in Turkey, Syria",d2023-02-07T12:55,KyivPost,-0.602,https://www.kyivpost.com/post/11905,AFP
OPINION: Liberal Hawks Versus Realist Doves: Who is Winning the Ideological War Over the Future of Ukraine?,d2023-02-05T12:31,KyivPost,0.0,https://www.kyivpost.com/post/11691,Robert G. Patman
16 Telegram Accounts to Follow for the Latest War News From Ukraine,d2023-02-05T09:45,KyivPost,0.0,https://www.kyivpost.com/post/11796,Stefan Korshak
Ukraine Returns 116 Defenders in POW Swap,d2023-02-04T12:07,KyivPost,0.0,https://www.kyivpost.com/post/11823,Interfax-Ukraine
OPINION: Setting the Conditions for Victory or Defeat,d2023-02-02T13:47,KyivPost,0.0,https://www.kyivpost.com/opinion/11760,Hans Petter Midttun
Human Rights Watch Accuses Ukraine of Using Banned Anti-Personnel Mines,d2023-02-01T15:57,KyivPost,-0.393,https://www.kyivpost.com/post/11734,Kyiv Post
EXCLUSIVE: Zhevago's Schemes Revealed - A Kyiv Post Investigation,d2023-02-01T11:18,KyivPost,-0.178,https://www.kyivpost.com/post/11718,Oleksiy Bobrovnikov
EU-Ukraine Summit to Take Place in Kyiv Friday,d2023-02-01T10:13,KyivPost,-0.437,https://www.kyivpost.com/post/11708,AFP
Ukrainian Cabinet’s New Conscription Rules: War-critical Workers May Avoid Draft,d2023-01-31T16:38,KyivPost,-0.218,https://www.kyivpost.com/post/11701,Stefan Korshak
"Winter Not Over, But Europe Braces for The Next One",d2023-01-31T11:08,KyivPost,0.0,https://www.kyivpost.com/post/11677,AFP
NATO Chief Asks S. Korea to 'Step Up' Military Support for Ukraine,d2023-01-30T15:21,KyivPost,-0.177,https://www.kyivpost.com/post/11652,AFP
"New Czech President Expected to Foster EU, Ukraine Ties",d2023-01-29T13:21,KyivPost,0.22,https://www.kyivpost.com/post/11617,AFP
OPINION: SDR Reallocation Can Solve Ukraine’s Debt Problem,d2023-01-28T13:25,KyivPost,0.0,https://www.kyivpost.com/opinion/11546,Timothy Ash
'Fierce' Battle in Ukraine for Vugledar Near Donetsk,d2023-01-28T10:28,KyivPost,-0.278,https://www.kyivpost.com/post/11593,AFP
Ukraine’s Defenders – Meet the M270 Operators and Crew of the 107th Rocket Artillery Brigade,d2023-01-28T10:07,KyivPost,0.0,https://www.kyivpost.com/post/11466,Stefan Korshak
Double Agent or Hero: Who Was Denys Kireyev and Why Was He Killed?,d2023-01-27T11:16,KyivPost,-0.237,https://www.kyivpost.com/post/11480,Anna Neplii
UNESCO Lists Odesa Historical Centre as World Heritage Site,d2023-01-26T13:02,KyivPost,0.0,https://www.kyivpost.com/post/11530,AFP
Zelensky Signs Controversial Law Toughening Punishment for Desertion in Army,d2023-01-25T14:48,KyivPost,-0.257,https://www.kyivpost.com/post/11498,AFP
"Two British Volunteers Died in Ukraine, Families Confirm",d2023-01-25T14:36,KyivPost,0.0,https://www.kyivpost.com/post/11496,Kyiv Post
President Zelensky Turns 45: What Supporters and Critics Say about Him,d2023-01-25T11:11,KyivPost,0.158,https://www.kyivpost.com/post/11482,Kyiv Post
"ICU Bond Market Weekly Insight: 23 January, 2023",d2023-01-24T15:37,KyivPost,0.0,https://www.kyivpost.com/post/11459,Kyiv Post
Sean Penn Ukraine Doc to Premiere at Berlin Film Fest,d2023-01-23T17:45,KyivPost,0.509,https://www.kyivpost.com/post/11436,AFP
EXPLAINED: Latest Estimates of Ukrainian and Russian Casualties,d2023-01-23T09:58,KyivPost,-0.406,https://www.kyivpost.com/post/11402,Kyiv Post
War Crimes More Apparent as Russia’s War Against Ukraine Continues,d2023-01-22T10:55,KyivPost,-0.55,https://www.kyivpost.com/post/11260,Mark Temnycky
"OPINION: How Poland Has been Smarter, More Principled, and Warmer than Germany",d2023-01-21T14:30,KyivPost,-0.333,https://www.kyivpost.com/post/11378,Stefan Tompson
The Key Weapons Ukraine Still Needs from Western Allies,d2023-01-21T09:49,KyivPost,0.0,https://www.kyivpost.com/post/11369,Stefan Korshak
What We Know About Putin’s Preparations for a Long-Term War,d2023-01-17T14:56,KyivPost,0.0,https://www.kyivpost.com/post/11231,Aleksandra Klitina
How April 2022 Kramatorsk Station Bombing Still Affects the City,d2023-01-17T12:32,KyivPost,-0.492,https://www.kyivpost.com/post/11224,AFP
U.S. and NATO Will Support an Anti-Russian Insurgency if Kremlin Attacks,d2023-01-17T12:01,KyivPost,0.0,https://www.kyivpost.com/ukraine-politics/u-s-and-nato-will-support-an-anti-russian-insurgency-if-kremlin-attacks.html,Roman Woronowycz
‘Black Grain’ of Odesa,d2023-01-15T16:30,KyivPost,-0.251,https://www.kyivpost.com/post/11154,Oleksiy Bobrovnikov
OPINION: ‘Slava Ukraini - Viva Venezuela Libre’,d2023-01-15T14:28,KyivPost,0.193,https://www.kyivpost.com/post/11053,Rodrigo Figueredo
Winter War in Ukraine: Russia’s Army Can No Longer Conduct a Large-Scale Offensive,d2023-01-15T10:45,KyivPost,-0.693,https://www.kyivpost.com/post/6599,Ugo Poletti
OPINION: A Year of War in Odesa,d2023-01-14T11:07,KyivPost,0.247,https://www.kyivpost.com/post/11128,Ugo Poletti
"Russia Claims Control of Soledar, Ukraine says Battle is Not Over",d2023-01-14T08:36,KyivPost,-0.379,https://www.kyivpost.com/post/11123,AFP
Italian Minister of Enterprise Visits Kyiv to Discuss Reconstruction,d2023-01-12T15:00,KyivPost,0.213,https://www.kyivpost.com/post/11066,Ugo Poletti
"Body of Missing British Volunteer Found in Eastern Ukraine, Russian Wagner Group Claims",d2023-01-12T14:17,KyivPost,-0.658,https://www.kyivpost.com/post/11062,Alisa Orlova
How Britain’s Challenger Tank Could Pave the Way for German Leopards,d2023-01-10T15:33,KyivPost,0.0,https://www.kyivpost.com/post/6592,Stefan Korshak
Ukrainians Will Need Travel Authorization Despite EU Application,d2023-01-10T13:30,KyivPost,0.0,https://www.kyivpost.com/post/6560,Emma Morris
EXPLAINED: Russia’s Highly Dubious Claim About Killing 600 Ukrainian Troops,d2023-01-09T10:18,KyivPost,-0.382,https://www.kyivpost.com/post/6525,Kyiv Post
Refugees Celebrate First Christmas Since Fleeing Ukraine,d2023-01-07T14:04,KyivPost,0.219,https://www.kyivpost.com/post/6505,AFP
The Meaning of this Christmas for Ukrainians: Interview with Archbishop Borys Gudziak,d2023-01-06T12:59,KyivPost,0.493,https://www.kyivpost.com/post/6467,Kyiv Post
Italian Military Expert on Ukraine’s Key Ingredient for Success Against Russia,d2023-01-03T16:16,KyivPost,0.0,https://www.kyivpost.com/post/6371,Ugo Poletti
"EXPLAINED: Why Germany’s Defence Minister is in Trouble Over a ""Disturbing"" Video",d2023-01-03T10:50,KyivPost,-0.689,https://www.kyivpost.com/post/6352,Kyiv Post
Military Chaplain Describes the ‘Incredible Moral Fatigue’ of Fighting in Bakhmut,d2023-01-02T11:56,KyivPost,-0.269,https://www.kyivpost.com/post/6331,AFP
Capturing the Soul of a Nation: Arts Year in Review,d2023-01-01T12:22,KyivPost,0.519,https://www.kyivpost.com/post/6115,Stash Luczkiw
The Decisive Battle of the Russo-Ukraine War So Far: Putin’s Disastrous Attempt to Capture Kyiv,d2023-01-01T11:20,KyivPost,-0.317,https://www.kyivpost.com/post/6038,Stefan Korshak
'A Lot of Pain': The Battle of Firefighters on Ukraine's Frontline,d2023-01-01T10:57,KyivPost,-0.553,https://www.kyivpost.com/post/6313,AFP
Zelensky: Ukraine Will Fight Until Victory,d2023-01-01T10:13,KyivPost,0.7,https://www.kyivpost.com/post/6315,AFP
"Zelensky, Ukraine's Comic Turned War-Time Leader - the AFP's Assessment",d2022-12-31T13:44,KyivPost,-0.248,https://www.kyivpost.com/post/6196,AFP
OPINION: Book Review: ‘Invasion: The Inside Story of Russia’s Bloody War and Ukraine’s Fight for Survival’ by Luke Harding,d2022-12-31T12:20,KyivPost,0.0,https://www.kyivpost.com/opinion/6178,Anders Aslund
OPINION: Results of the Stormy Year That Was 2022,d2022-12-31T12:11,KyivPost,-0.263,https://www.kyivpost.com/opinion/6233,Ihor Zhdanov
Biden Signs $1.7 Trillion US Government Spending Bill,d2022-12-30T12:47,KyivPost,0.0,https://www.kyivpost.com/post/6267,AFP
OPINION: 2022: The Year of the Blood-Stained Bird,d2022-12-30T10:33,KyivPost,0.0,https://www.kyivpost.com/post/6189,Volodymyr Fesenko
OPINION: Protection From Russia – an Obligation in 2023 as Well,d2022-12-29T10:53,KyivPost,-0.559,https://www.kyivpost.com/opinion/6221,Dr. Orhan Dragas
How Foreign Businesses in Ukraine Cope With the War,d2022-12-26T11:43,KyivPost,0.0,https://www.kyivpost.com/post/5923,Anna Neplii
Ukraine Estimates Grain Harvest Fell Around 40%,d2022-12-24T10:18,KyivPost,-0.717,https://www.kyivpost.com/post/6072,AFP
Children of War: Photo Project Shows the Creepy Everyday Life of Young Ukrainians,d2022-12-21T12:36,KyivPost,0.0,https://www.kyivpost.com/post/5959,Anna Neplii
IMF Approves Program to Help Ukraine Secure Donor Funding,d2022-12-20T12:28,KyivPost,0.0,https://www.kyivpost.com/post/5920,AFP
"Kyiv Post Morning Memo – Everything You Need to Know on Tuesday, Dec. 20",d2022-12-20T10:17,KyivPost,0.0,https://www.kyivpost.com/post/5910,Kyiv Post
"OPINION: Residual Russian Empire, Disguised as Federation, Under Threat",d2022-12-17T11:11,KyivPost,-0.172,https://www.kyivpost.com/opinion/5680,Askold S. Lozynskyj
Exiled Chechen Leader Fears Influx of Russian Terrorists into Ukraine,d2022-12-16T13:15,KyivPost,0.0,https://www.kyivpost.com/post/5793,Oleksiy Bobrovnikov
The Russians Helping Ukrainian Refugees in Bulgaria,d2022-12-14T09:45,KyivPost,-0.489,https://www.kyivpost.com/post/5721,AFP
"Odesa Corruption Reveals Russian, Chinese and Internal Ukrainian Involvement",d2022-12-13T15:18,KyivPost,0.0,https://www.kyivpost.com/post/5709,Oleksiy Bobrovnikov
OPINION: Gratitude to Ukraine,d2022-12-13T12:17,KyivPost,-0.29,https://www.kyivpost.com/post/5687,Timothy Snyder
"Kyiv Post Morning Memo – Everything You Need to Know on Tuesday, Dec. 13",d2022-12-13T11:05,KyivPost,0.0,https://www.kyivpost.com/post/5686,Kyiv Post
"Ukrainian, Russian Nobel Peace Winners Slam Putin's 'Insane' War",d2022-12-10T17:52,KyivPost,-0.207,https://www.kyivpost.com/post/5610,AFP
Kremlin Critic Sentenced to Eight and a Half Years by Moscow Court,d2022-12-09T14:40,KyivPost,-0.514,https://www.kyivpost.com/post/5577,Jay Beecher
Ukraine Lawmaker: Radiation Leaks Are Biggest Threat to Ecology,d2022-12-07T00:00,KyivPost,-0.418,https://archive.kyivpost.com/multimedia/video/ukraine-lawmaker-radiation-leaks-are-biggest-threat-to-ecology,Kyiv Post
Six Days in Russian Captivity – Mayor of Melitopol Speaks Out,d2022-12-07T00:00,KyivPost,0.0,https://archive.kyivpost.com/multimedia/video/six-days-in-russian-captivity-mayor-of-melitopol-speaks-out,Kyiv Post
Armed Forces of Ukraine Day: Milestones in the Push to Evict Russian Invaders,d2022-12-06T09:46,KyivPost,0.0,https://www.kyivpost.com/ukraine-politics/armed-forces-of-ukraine-day-milestones-in-the-push-to-evict-russian-invaders.html,Stefan Korshak
“My Dream is for the Empire to Disintegrate”: Wartime Theater in Lviv,d2022-12-04T17:03,KyivPost,0.246,https://www.kyivpost.com/post/5477,Milovan Mracevich
"ISW Russian Offensive Campaign Assessment, December 3",d2022-12-04T10:00,KyivPost,-0.25,https://www.kyivpost.com/russias-war/isw-russian-offensive-campaign-assessment-december-3.html,ISW
“I was Lucky to Survive” – Interview with Journalist and Mariupol Resident Andriy Marusov,d2022-11-29T14:29,KyivPost,0.0,https://www.kyivpost.com/post/29,Marichka Palamarchuk
EXPLAINED: The ‘Substantial’ US Aid Package for Ukraine that Could be Announced Today,d2022-11-29T09:42,KyivPost,-0.247,https://www.kyivpost.com/russias-war/explained-the-substantial-us-aid-package-for-ukraine-that-could-be-announced-today.html,Kyiv Post
OPINION: Pope Francis Draws Comparison Between Stalin’s Holodomor and Putin’s Invasion,d2022-11-28T21:07,KyivPost,-0.376,https://www.kyivpost.com/opinion/4797,Ugo Poletti
“I Saw Animals with Cut-Off Ears. I Don’t Understand Why the Russians Did It.”,d2022-11-28T16:47:47,KyivPost,-0.359,https://www.kyivpost.com/multimedia/video/i-saw-animals-with-cut-off-ears-i-dont-understand-why-the-russians-did-it,Alisa Orlova
EXPLAINED: Why Zelensky and Klitschko are Having a Public Falling Out,d2022-11-28T15:23,KyivPost,-0.274,https://www.kyivpost.com/ukraine-politics/explained-why-zelensky-and-klitschko-having-public-falling-out.html,Alisa Orlova
‘Little By Little’: Ukraine Grinds Away on the Northeastern Front,d2022-11-28T11:01,KyivPost,-0.277,https://www.kyivpost.com/post/43,AFP
"OPINION: Russia – A Riddle no More, Finally the Harsh Truth (Part 2: Concluded)",d2022-11-25T17:18,KyivPost,-0.215,https://www.kyivpost.com/opinion/62,Bohdan Nahaylo
OPINION: Why Sergei Magnitsky’s Death Wasn’t in Vain,d2022-11-25T10:59,KyivPost,-0.453,https://www.kyivpost.com/opinion/4817,Dr. Orhan Dragas
7 Biggest Ecological Threats in Ukraine from Russia’s War,d2022-11-24T09:51,KyivPost,-0.44,https://www.kyivpost.com/post/4830,Kyiv Post
Thirty-six people returned to Ukraine in new POWs swap,d2022-11-23T17:18,KyivPost,-0.21,https://www.kyivpost.com/post/83,AFP
"OPINION: Democratic Values as Basis of Prosperity, Protection From War",d2022-11-23T17:07,KyivPost,0.0,https://www.kyivpost.com/post/4834,Anna Neplii
OPINION: The ‘Desert Ukraine to Defend Taiwan’ Fallacy,d2022-11-22T13:25,KyivPost,-0.24,https://www.kyivpost.com/opinion/101,Robert Zubrin
"FACT-CHECK: No, Zelensky Didn’t Invest Billions into Collapsed FTX",d2022-11-21T17:47,KyivPost,-0.346,https://www.kyivpost.com/post/4844,Jay Beecher
"OPINION: While Russian Army Remains in Ukraine, Putin’s Calls for Peace Talks are Fake",d2022-11-20T12:21,KyivPost,0.0,https://www.kyivpost.com/article/opinion/op-ed/while-russian-army-remains-in-ukraine-putins-calls-for-peace-talks-are-fake.html,Dr. Orhan Dragas
"Dangerous Waters: As Russia monopolizes Azov Sea, Mariupol feels heightened danger",d2022-11-19T18:13,KyivPost,-0.293,https://www.kyivpost.com/ukraine-politics/as-russia-monopolizes-azov-sea-mariupol-feels-heightened-danger.html,Oksana Grytsenko
OPINION: Only Ukraine Can Set Peace Terms – Not Russia,d2022-11-19T10:58,KyivPost,0.0,https://www.kyivpost.com/opinion/138,Dr. Orhan Dragas
Russia Says “Fortifying” Annexed Crimean Peninsula,d2022-11-18T12:23,KyivPost,-0.183,https://www.kyivpost.com/russias-war/russia-says-fortifying-annexed-crimean-peninsula.html,AFP
"Republicans Take Control of US House, Congress Split: Projections",d2022-11-17T11:26,KyivPost,0.0,https://www.kyivpost.com/world/republicans-take-control-of-us-house-congress-split-projections.html,AFP
OPINION: Odesa Rejects Catherine the Great as Putin’s Invasion Makes Russia Toxic,d2022-11-16T13:53,KyivPost,-0.158,https://www.kyivpost.com/opinion/4873,Oleksiy Honcharenko
Ukraine Says Power Being Restored After Russian Strikes,d2022-11-16T13:07,KyivPost,-0.32,https://www.kyivpost.com/ukraine-politics/ukraine-says-power-being-restored-after-russian-strikes.html,AFP
Russia Under Pressure as G20 Voices Unease Over Ukraine War,d2022-11-15T14:28,KyivPost,-0.328,https://www.kyivpost.com/post/4882,AFP
Russia Faces G20 Calls To End Ukraine War,d2022-11-15T10:33,KyivPost,0.0,https://www.kyivpost.com/post/199,AFP
"ISW Russian Offensive Campaign Assessment, November 14",d2022-11-15T09:59,KyivPost,-0.374,https://www.kyivpost.com/post/201,ISW
"UN, Russia Grain, Fertiliser Exports Talks end Without Breakthrough",d2022-11-12T12:00,KyivPost,0.0,https://www.kyivpost.com/russias-war/un-russia-grain-fertiliser-exports-talks-end-without-breakthrough.html,AFP
"Flowers, Mines Welcome Ukraine Forces on Road to Kherson",d2022-11-12T11:38,KyivPost,0.151,https://www.kyivpost.com/russias-war/flowers-mines-welcome-ukraine-forces-on-road-to-kherson.html,AFP
Spain to Send Two More Air Defence Systems to Ukraine,d2022-11-10T17:21,KyivPost,0.0,https://www.kyivpost.com/world/spain-to-send-two-more-air-defence-systems-to-ukraine.html,AFP
Khaki Nation: Ukraine Dresses For War,d2022-11-10T13:26,KyivPost,0.0,https://www.kyivpost.com/ukraine-politics/khaki-nation-ukraine-dresses-for-war.html,AFP
Eurotopics – How Significant is Russia’s Withdrawal from Kherson?,d2022-11-10T13:16,KyivPost,-0.243,https://www.kyivpost.com/russias-war/eurotopics-how-significant-is-russias-withdrawal-from-kherson.html,euro topics
Brussels Proposes 18-bn-euro Ukraine Aid Package,d2022-11-09T15:45,KyivPost,0.166,https://www.kyivpost.com/post/4920,AFP
U.S. – Russia Meeting Expected Soon on Resumption of Nuclear Inspections,d2022-11-09T12:32,KyivPost,0.0,https://www.kyivpost.com/world/u-s-russia-meeting-expected-soon-on-resumption-of-nuclear-inspections.html,AFP
Ukraine’s Zelensky Tells COP27 Russia’s War Harms Climate Efforts,d2022-11-09T10:47,KyivPost,0.0,https://www.kyivpost.com/ukraine-politics/ukraines-zelensky-tells-cop27-russias-war-harms-climate-efforts.html,AFP
ICU Weekly Insight: 8 November 2022,d2022-11-08T16:31,KyivPost,0.0,https://www.kyivpost.com/post/4930,Kyiv Post
Eurotopics – War Against Ukraine: Can Diplomacy Still Help?,d2022-11-08T13:17,KyivPost,-0.324,https://www.kyivpost.com/ukraine-politics/eurotopics-war-against-ukraine-can-diplomacy-still-help.html,euro topics
Zelensky Congratulates Netanyahu on Israel Election Win,d2022-11-08T12:38,KyivPost,0.0,https://www.kyivpost.com/world/zelensky-congratulates-netanyahu-on-israel-election-win.html,AFP
"ISW Russian Offensive Campaign Assessment, November 7",d2022-11-08T10:01,KyivPost,-0.377,https://www.kyivpost.com/russias-war/isw-russian-offensive-campaign-assessment-november-7.html,ISW
In-Depth: Ukrainian Partisans Become Gamechangers in Russia’s War,d2022-11-04T12:03,KyivPost,-0.168,https://www.kyivpost.com/post/355,Aleksandra Klitina
Russian Strikes Leave 4.5 Million Without Power in Ukraine: Zelensky,d2022-11-04T10:35,KyivPost,-0.233,https://www.kyivpost.com/ukraine-politics/russian-strikes-leave-4-5-million-without-power-in-ukraine-zelensky.html,AFP
Ukrainian Ballet on European Stage: Full House in Lithuania,d2022-11-02T16:22,KyivPost,0.884,https://www.kyivpost.com/ukraine-politics/ukrainian-ballet-on-european-stage-full-house-in-lithuania.html,Kyiv Post
Kyivstar Allocates Hr 300 Million to State for Restoring Infrastructure: 50% Already on State Account,d2022-11-02T15:37,KyivPost,0.493,https://www.kyivpost.com/post/4963,Kyiv Post
"To the Australian People, Thank You From all Ukrainians",d2022-11-01T10:13,KyivPost,0.414,https://www.kyivpost.com/article/opinion/op-ed/to-the-australian-people-thank-you-from-all-ukrainians.html,Kyiv Post
Turkish Baykar to Install Air-to-Air Missiles on Drones,d2022-10-31T15:24,KyivPost,0.0,https://www.kyivpost.com/russias-war/turkish-baykar-to-install-air-to-air-missiles-on-drones.html,Kyiv Post
OPINION: A Ceasefire Would Condemn Millions of Ukrainians to Russian Occupation,d2022-10-29T12:56,KyivPost,-0.341,https://www.kyivpost.com/opinion/444,Mark Temnycky
Russian Oppositionist Appeals to US Congress Caucus,d2022-10-29T10:54,KyivPost,0.0,https://www.kyivpost.com/article/opinion/op-ed/open-letter-to-us-congressional-progressive-caucus-how-russia-and-ukraine-can-both-win.html,Ilya Ponomarev
"ISW Russian Offensive Campaign Assessment, October 28",d2022-10-29T10:03,KyivPost,-0.22,https://www.kyivpost.com/ukraine-politics/isw-russian-offensive-campaign-assessment-october-28.html,ISW
Sanctions Really Are Hurting Russia – Analyst,d2022-10-28T12:23,KyivPost,-0.276,https://www.kyivpost.com/russias-war/sanctions-really-are-hurting-russia-analyst.html,Kyiv Post
Eurotopics – Will “Dirty Bombs” Be Used?,d2022-10-28T11:36,KyivPost,-0.893,https://www.kyivpost.com/post/464,euro topics
Ukrainian Security Service Reveals 33 Russian “Agents in Cassocks”,d2022-10-27T18:48,KyivPost,0.0,https://www.kyivpost.com/ukraine-politics/ukrainian-security-service-reveals-33-russian-agents-in-cassocks.html,Kyiv Post
“Mobilization” and “Retreat”: Internet Search Data Reveals Russians’ Changing Concerns,d2022-10-27T15:44,KyivPost,0.0,https://www.kyivpost.com/post/475,Aleksandra Klitina
Russia Undertakes Nuclear Drills As Fighting Heavy Near Bakhmut,d2022-10-27T10:18,KyivPost,-0.231,https://www.kyivpost.com/russias-war/russia-undertakes-nuclear-drills-as-fighting-heavy-near-bakhmut.html,AFP
UN Satellite Analysis Tracks Ukraine Cultural Damage,d2022-10-27T10:12,KyivPost,0.0,https://www.kyivpost.com/ukraine-politics/un-satellite-analysis-tracks-ukraine-cultural-damage.html,AFP
"Biden, Sunak Agree to Support Ukraine, Stand Up to China: White House",d2022-10-26T12:48,KyivPost,0.0,https://www.kyivpost.com/world/biden-sunak-agree-to-support-ukraine-stand-up-to-china-white-house.html,AFP
World Bank Disburses Additional $500M to Help Ukraine Meet Urgent Needs,d2022-10-25T11:10,KyivPost,0.0,https://www.kyivpost.com/ukraine-politics/world-bank-disburses-additional-500m-to-help-ukraine-meet-urgent-needs.html,UkrInform
Sculpture By The Sea To Showcase Of Leading Ukrainian Artists On Bondi Coastal Walk,d2022-10-23T12:52,KyivPost,0.56,https://www.kyivpost.com/post/5038,Kyiv Post
Ukraine TV Struggles on Despite War,d2022-10-22T10:27,KyivPost,-0.15,https://www.kyivpost.com/ukraine-politics/ukraine-tv-struggles-on-despite-war.html,AFP
Lawmakers’ Initiative to Recognize Belarus as Russian Occupied,d2022-10-21T16:02,KyivPost,-0.222,https://www.kyivpost.com/post/5050,Kyiv Post
Cold Weather Brings Tougher Conditions To Fighting In Ukraine,d2022-10-20T10:14,KyivPost,0.0,https://www.kyivpost.com/russias-war/cold-weather-brings-tougher-conditions-to-fighting-in-ukraine.html,AFP
Steinmeier Cancels Kyiv Visit Over Security Concerns,d2022-10-20T10:05,KyivPost,-0.561,https://www.kyivpost.com/russias-war/steinmeier-cancels-kyiv-visit-over-security-concerns.html,UkrInform
People of Ukraine Win EU Rights Award,d2022-10-20T10:04,KyivPost,0.0,https://www.kyivpost.com/ukraine-politics/people-of-ukraine-win-eu-rights-award.html,AFP
Eurotopics – Iranian Combat Drones in the War Against Ukraine,d2022-10-19T15:53,KyivPost,-0.38,https://www.kyivpost.com/world/eurotopics-iranian-combat-drones-in-the-war-against-ukraine.html,euro topics
Football Icon Shevchenko Feels Pain and Pride in Ukraine’s Resilience,d2022-10-19T13:32,KyivPost,0.0,https://www.kyivpost.com/ukraine-politics/football-icon-shevchenko-feels-pain-and-pride-in-ukraines-resilience.html,AFP
"ISW Russian Offensive Campaign Assessment, October 18",d2022-10-19T10:01,KyivPost,-0.491,https://www.kyivpost.com/russias-war/isw-russian-offensive-campaign-assessment-october-18.html,ISW
5 More Vessels Depart From Ukrainian Ports Through Grain Corridor,d2022-10-18T15:10,KyivPost,0.38,https://www.kyivpost.com/ukraine-politics/5-more-vessels-depart-from-ukrainian-ports-through-grain-corridor.html,Kyiv Post
ICU Weekly Insight: 18 Oct. 2022,d2022-10-18T10:46,KyivPost,0.0,https://www.kyivpost.com/post/5068,Kyiv Post
"ISW Russian Offensive Campaign Assessment, October 16",d2022-10-17T10:05,KyivPost,-0.288,https://www.kyivpost.com/russias-war/isw-russian-offensive-campaign-assessment-october-16.html,ISW
Breaking: Russians Attack Kyiv with Kamikaze Drones,d2022-10-17T08:44,KyivPost,-0.358,https://www.kyivpost.com/ukraine-security/breaking-russians-attack-kyiv-with-kamikaze-drones.html,AFP
How to Deal With A**holes,d2022-10-15T10:06,KyivPost,0.0,https://www.kyivpost.com/article/opinion/op-ed/how-to-deal-with-aholes.html,Pete Shmigel
OPINION: How to Deal With A**holes,d2022-10-15T10:06,KyivPost,0.0,https://www.kyivpost.com/opinion/673,Pete Shmigel
"Over 5,000 Applications to Join “Freedom of Russia” Legion – Fighter Caesar",d2022-10-14T17:26,KyivPost,-0.379,https://www.kyivpost.com/russias-war/over-5000-applications-to-join-freedom-of-russia-legion-fighter-caesar.html,Aleksandra Klitina
Ukraine Airs ‘Romantic’ Video Asking France for More Guns,d2022-10-13T12:55,KyivPost,0.0,https://www.kyivpost.com/ukraine-politics/ukraine-airs-romantic-video-asking-france-for-more-guns.html,AFP
