title,date_str,siteName,sentiment,pageUrl,author
Images Show Captured Ukrainian Troops Returning Home – Many Injured,d2022-06-30T13:03,KyivPost,0.0,https://www.kyivpost.com/post/2402,Aleksandra Klitina
Sean Penn came back to Ukraine for documentary,d2022-06-30T11:04,KyivPost,0.0,https://www.kyivpost.com/post/6865,Aleksandra Klitina
Rinat Akhmetov suing Russia,d2022-06-27T18:05,KyivPost,-0.751,https://www.kyivpost.com/russias-war/rinat-akhmetov-suing-russia.html,Aleksandra Klitina
"Ukrainians vote to change names of Russian-themed streets, squares",d2022-06-27T17:34,KyivPost,0.211,https://www.kyivpost.com/ukraine-politics/ukrainians-vote-to-change-names-of-russian-themed-streets-squares.html,Iryna Pavlenko
The Dark Underbelly of Ukrainophobia,d2022-06-26T13:07,KyivPost,-0.296,https://www.kyivpost.com/article/opinion/op-ed/the-dark-underbelly-of-ukrainophobia.html,Askold S. Lozynskyj
Ukraine’s economy: What’s it lost and what does it still have?,d2022-06-25T10:51,KyivPost,-0.468,https://www.kyivpost.com/ukraine-politics/ukraines-economy-whats-it-lost-and-what-does-it-still-have.html,John Marone
"ISW Russian Offensive Campaign Assessment, June 24",d2022-06-25T10:39,KyivPost,-0.3,https://www.kyivpost.com/post/2438,Bohdan Nahaylo
